input,output
"What is CPU usage?","CPU usage represents the percentage of CPU resources used by a process or system."
"How does high CPU usage affect performance?","High CPU usage can cause slow response times and decreased system performance."
"What happens when memory usage increases?","Excessive memory usage can lead to swapping, slowing down the system."
"Describe the impact of low memory availability.","Low memory availability can cause applications to slow down or crash."
"What causes high CPU usage?","High CPU usage can be caused by resource-intensive processes or poorly optimized software."
"How does CPU usage affect system responsiveness?","High CPU usage can cause sluggish system responsiveness and delayed task execution."
"What are the consequences of excessive memory consumption?","Excessive memory consumption can lead to memory exhaustion, causing system instability."
"How does memory usage impact application performance?","High memory usage can cause applications to slow down, freeze, or terminate unexpectedly."
"What is disk I/O?","Disk I/O refers to the input/output operations on a storage device."
"How does disk I/O affect system performance?","High disk I/O can slow down system performance by creating bottlenecks."
"What is a process in computing?","A process is an instance of a program that is being executed."
"What is a thread?","A thread is the smallest unit of a process that can be scheduled for execution."
"What is the difference between a process and a thread?","A process is an independent program while a thread is a segment of a process."
"How does network latency impact performance?","High network latency can cause delays in data transmission and slow down application performance."
"What is virtual memory?","Virtual memory is a memory management technique that provides an application with more memory than physically available."
"Why is cache memory important?","Cache memory improves performance by storing frequently accessed data for quick retrieval."
"What is a context switch?","A context switch is the process of storing and restoring the state of a CPU so that multiple processes can share a single CPU."
"How does a context switch affect performance?","Frequent context switches can degrade performance due to overhead."
"What is a memory leak?","A memory leak occurs when a program does not release memory that is no longer needed."
"How can memory leaks be prevented?","Memory leaks can be prevented by properly managing memory allocation and deallocation."
"What is a CPU core?","A CPU core is a single processing unit within a CPU that can execute instructions independently."
"How does multi-threading improve performance?","Multi-threading improves performance by allowing multiple threads to run concurrently, making better use of CPU resources."
"What is system load?","System load is a measure of the amount of computational work that a computer system is performing."
"Why is RAM important for system performance?","RAM is important because it stores data that is actively being used, allowing for quick access and efficient processing."
"What is a deadlock?","A deadlock is a situation where two or more processes are unable to proceed because each is waiting for the other to release resources."
"How can deadlocks be avoided?","Deadlocks can be avoided by ensuring that resource allocation is managed carefully and by using techniques like resource ordering."
"What is a swap file?","A swap file is a space on a hard drive used as virtual memory when the physical RAM is full."
"What is CPU throttling?","CPU throttling is the process of reducing the clock speed of a CPU to decrease heat generation and save power."
"What is the impact of a slow hard drive on system performance?","A slow hard drive can significantly reduce system performance by causing delays in data retrieval and storage operations."
"How does garbage collection work in programming?","Garbage collection is an automatic memory management process that frees up memory occupied by objects that are no longer in use."
"What is a cache hit?","A cache hit occurs when the data requested for processing by a component or application is found in the cache memory."
"What is a cache miss?","A cache miss occurs when the data requested for processing by a component or application is not found in the cache memory and must be fetched from another memory layer."
"How does caching improve performance?","Caching improves performance by reducing the time needed to access frequently used data, thereby speeding up data retrieval."
"What is paging in operating systems?","Paging is a memory management scheme that eliminates the need for contiguous allocation of physical memory by dividing memory into fixed-size pages."
"How does virtual memory work?","Virtual memory allows the execution of processes that may not be completely in the main physical memory, by temporarily transferring data from RAM to disk storage."
"What are the benefits of virtual memory?","Virtual memory allows for larger programs to run on a system and provides isolation between different processes."
"What is an interrupt in computing?","An interrupt is a signal to the processor emitted by hardware or software indicating an event that needs immediate attention."
"What is the role of the operating system in managing hardware resources?","The operating system manages hardware resources by allocating CPU time, memory space, and I/O resources to various applications and processes."
"How does the CPU scheduler work?","The CPU scheduler determines which process runs at a given time by selecting from among the processes in memory that are ready to execute."
"What is the difference between preemptive and non-preemptive scheduling?","Preemptive scheduling allows a process to be interrupted in the middle of execution and moved to the ready queue, while non-preemptive scheduling runs a process to completion."
"What is a semaphore in operating systems?","A semaphore is a synchronization primitive used to control access to a common resource in concurrent system programming."
"What is the function of a memory manager?","The memory manager handles the allocation and deallocation of memory spaces as needed by programs during execution."
"How does process synchronization work?","Process synchronization ensures that multiple processes can operate safely and without interference when accessing shared resources."
"What is a thread pool?","A thread pool is a collection of pre-initialized threads that can be used to execute tasks, improving performance by reusing threads instead of creating them from scratch."
"How does CPU affinity affect performance?","CPU affinity improves performance by binding processes to specific CPU cores, reducing cache misses and improving data locality."
"What is the purpose of the page table?","The page table stores the mapping between virtual addresses and physical addresses in memory."
"What is a context switch overhead?","Context switch overhead refers to the time and resources required to switch the CPU from one process or thread to another."
"What is a race condition?","A race condition occurs when the behavior of software depends on the relative timing of events such as thread execution sequences."
"How can race conditions be avoided?","Race conditions can be avoided by using synchronization mechanisms like locks, semaphores, and monitors to control access to shared resources."
"What is a critical section in concurrent programming?","A critical section is a part of a program that accesses a shared resource that must not be concurrently accessed by more than one thread or process."
"How does the operating system manage deadlocks?","The operating system can manage deadlocks by using methods like deadlock prevention, deadlock avoidance, and deadlock detection and recovery."
"What is a heap in memory management?","The heap is an area of memory used for dynamic memory allocation where blocks of memory are allocated and freed in an arbitrary order."
"How does garbage collection help manage memory?","Garbage collection automatically frees memory that is no longer in use by identifying and reclaiming memory occupied by unreachable objects."
"What is a stack in memory management?","The stack is a region of memory that stores temporary variables created by each function, including function parameters, return addresses, and local variables."
"What is the difference between stack and heap memory?","Stack memory is used for static memory allocation, while heap memory is used for dynamic memory allocation."
"What is a segmentation fault?","A segmentation fault occurs when a program attempts to access a memory location that it is not allowed to access."
"How does virtual memory increase system stability?","Virtual memory increases system stability by isolating processes and providing a buffer against memory overflows and corruption."
"What is the role of the kernel in an operating system?","The kernel is the core component of an operating system, responsible for managing system resources, including memory, processes, and hardware devices."
"How do system calls work in operating systems?","System calls provide the interface between a running program and the operating system, allowing user-level processes to request services from the OS."
"What is memory fragmentation?","Memory fragmentation occurs when free memory is divided into small, non-contiguous blocks, making it difficult to allocate large contiguous blocks."
"How can memory fragmentation be reduced?","Memory fragmentation can be reduced by using memory allocation algorithms like best fit, worst fit, and buddy system, as well as through compaction techniques."
"What is a page fault?","A page fault occurs when a program tries to access a page that is not currently mapped to the physical memory, requiring the operating system to fetch the page from disk."
"How is a page fault handled?","A page fault is handled by the operating system, which pauses the process, loads the required page from disk into memory, updates the page table, and then resumes the process."
"What is thrashing in virtual memory systems?","Thrashing occurs when a system spends more time swapping pages in and out of memory than executing processes, severely degrading performance."
"How can thrashing be prevented?","Thrashing can be prevented by using appropriate page replacement algorithms, adjusting the degree of multiprogramming, and ensuring sufficient physical memory."
"What is the role of the memory management unit (MMU)?","The MMU is responsible for handling virtual memory operations, translating virtual addresses to physical addresses, and managing memory protection."
"What is demand paging?","Demand paging is a memory management technique where pages are loaded into memory only when they are needed, rather than preloading all pages of a program."
"How does a process differ from a program?","A process is an instance of a program in execution, including its code, data, and state, while a program is a static set of instructions."
"What is the difference between multitasking and multiprocessing?","Multitasking allows multiple tasks to run concurrently on a single CPU, while multiprocessing uses multiple CPUs to execute multiple tasks simultaneously."
"What is a time slice in CPU scheduling?","A time slice is a fixed amount of CPU time allocated to a process before the scheduler preempts it to give other processes a chance to run."
"How does the first-come, first-served (FCFS) scheduling algorithm work?","FCFS scheduling allocates CPU time to processes in the order they arrive, running each process to completion before moving on to the next."
"What is the round-robin scheduling algorithm?","Round-robin scheduling allocates a fixed time slice to each process in a cyclic order, ensuring that all processes get an equal share of the CPU."
"What is priority scheduling?","Priority scheduling allocates CPU time based on the priority of processes, with higher-priority processes getting preference over lower-priority ones."
"What is the difference between internal and external fragmentation?","Internal fragmentation occurs when allocated memory contains unused space, while external fragmentation occurs when free memory is scattered in small blocks."
"What is a memory pool?","A memory pool is a preallocated block of memory that can be used to satisfy memory allocation requests, reducing the overhead of dynamic memory allocation."
"What is a page replacement algorithm?","A page replacement algorithm determines which memory pages to swap out when new pages are needed, with common algorithms including LRU, FIFO, and LFU."
"How does the least recently used (LRU) page replacement algorithm work?","The LRU algorithm replaces the page that has not been used for the longest period of time, assuming that pages used recently will likely be used again soon."
"What is the FIFO page replacement algorithm?","The FIFO algorithm replaces the oldest page in memory, based on the assumption that the oldest pages are the least likely to be used again."
"What is the LFU page replacement algorithm?","The LFU algorithm replaces the page with the fewest accesses, based on the assumption that pages with fewer accesses are less likely to be used again."
"What is a memory barrier?","A memory barrier is a type of synchronization mechanism that ensures memory operations are completed in a specific order, preventing certain types of memory access issues."
"What is a page directory?","A page directory is a data structure used in virtual memory systems to store references to page tables, facilitating the translation of virtual addresses to physical addresses."
"What is an access violation?","An access violation occurs when a program attempts to read or write to a memory location that it does not have permission to access."
"What is the purpose of the swap space?","Swap space is used to extend the amount of physical memory available by swapping out inactive pages from RAM to disk, allowing more processes to run concurrently."
"What is a non-maskable interrupt (NMI)?","An NMI is a hardware interrupt that cannot be ignored by the processor, typically used for high-priority or emergency tasks."
"How does direct memory access (DMA) improve performance?","DMA improves performance by allowing devices to transfer data directly to and from memory without involving the CPU, freeing the CPU to perform other tasks."
"What is the purpose of a memory map?","A memory map defines the layout of a program's memory, including the allocation of code, data, stack, and heap segments."
"What is the difference between physical and logical addresses?","A physical address refers to a location in the physical memory, while a logical address is used by a program and must be translated to a physical address by the MMU."
"What is a bootloader?","A bootloader is a small program that initializes the system hardware and loads the operating system kernel into memory during the boot process."
"What is a firmware?","Firmware is a type of software embedded in hardware devices, providing low-level control and functionality for the hardware."
"How does a hypervisor work?","A hypervisor, or virtual machine monitor, allows multiple operating systems to run concurrently on a single physical machine by managing the hardware resources and isolating each OS."
"What is a microkernel?","A microkernel is a minimalistic kernel design that performs only the essential functions of an operating system, delegating other services to user-space programs."
"What is the role of a device driver?","A device driver is a specialized program that allows the operating system to communicate with and control hardware devices."
"What is a file system?","A file system is a method for storing and organizing files and directories on a storage device, providing a way for the operating system to manage data."
"What is the difference between a monolithic kernel and a microkernel?","A monolithic kernel includes all operating system services in a single large kernel, while a microkernel provides minimal core services, with other services running in user space."
"What is a system call interface?","The system call interface is the programming interface through which user programs request services from the operating system kernel."
"What is the role of the scheduler in an operating system?","The scheduler manages the execution of processes by determining which process runs at a given time and for how long, ensuring efficient use of CPU resources."
"What is a shell in computing?","A shell is a user interface that provides access to the operating system's services, typically through a command-line interface or graphical user interface."
"What is a daemon in operating systems?","A daemon is a background process that runs continuously, providing various services such as web server, printing, and email."
"What is a thread context?","A thread context includes all the information needed to manage a thread, such as its register state, stack, and scheduling information."
"What is a process table?","A process table is a data structure maintained by the operating system to keep track of all active processes, including their state, memory allocation, and other attributes."
"What is the difference between a hard real-time system and a soft real-time system?","A hard real-time system requires tasks to be completed within strict deadlines, while a soft real-time system allows some flexibility in meeting deadlines."
"What is the purpose of a watchdog timer?","A watchdog timer is a hardware timer that triggers a system reset or other corrective action if the system fails to respond within a specified time, helping to recover from software or hardware faults."
"What is a system call?","A system call is a programmed request to the operating system to perform a specific task, such as file operations, process management, or communication."
"What is an interrupt service routine (ISR)?","An ISR is a special function that handles interrupts, performing the necessary processing and then returning control to the interrupted program."
"What is a task scheduler?","A task scheduler is a component of an operating system that manages the execution of tasks, ensuring that each task gets its fair share of CPU time and resources."
"What is the difference between synchronous and asynchronous I/O?","Synchronous I/O operations block the requesting process until the operation is complete, while asynchronous I/O operations allow the process to continue executing while the I/O operation is performed in the background."
"What is the role of the file allocation table (FAT)?","The FAT is a data structure used by the FAT file system to keep track of the location of files and directories on a disk, managing the allocation of disk space."
"What is the purpose of a journaling file system?","A journaling file system maintains a journal of changes to the file system, allowing it to recover quickly and reliably from crashes or power failures."
"What is the difference between a partition and a volume?","A partition is a contiguous block of storage space on a physical disk, while a volume is a logical unit of storage that can span multiple partitions or disks."
"What is a network file system (NFS)?","NFS is a protocol that allows files to be accessed and shared over a network, enabling remote file access as if the files were on a local disk."
"What is a disk quota?","A disk quota is a limit set by an administrator on the amount of disk space that a user or group can use, helping to manage and allocate storage resources."
"What is the purpose of a virtual file system (VFS)?","A VFS provides an abstraction layer that allows different file systems to be accessed through a common interface, simplifying file system operations for applications and users."
"What is the difference between symmetric and asymmetric multiprocessing?","Symmetric multiprocessing (SMP) treats all processors as equals, with each processor having access to all memory and I/O, while asymmetric multiprocessing (AMP) assigns specific tasks to specific processors, with only one processor controlling the system."
"What is a thread-safe function?","A thread-safe function is designed to operate correctly and safely when called concurrently by multiple threads, typically by using synchronization mechanisms to manage access to shared resources."
"What is a real-time operating system (RTOS)?","An RTOS is designed to manage hardware resources and execute tasks within strict timing constraints, ensuring that critical tasks are completed on time."
"What is a load balancer?","A load balancer distributes incoming network traffic across multiple servers to ensure efficient use of resources, improve performance, and increase redundancy."
"What is a kernel panic?","A kernel panic is a critical error in the operating system kernel that causes the system to halt, typically requiring a reboot to recover."
"What is a memory mapped file?","A memory mapped file is a file that has been mapped into the address space of a process, allowing the file to be accessed as if it were part of the process's memory."
"What is a softirq?","A softirq is a type of software interrupt that is used to handle time-consuming tasks that cannot be performed within a hardware interrupt handler, allowing the system to defer work to a later time."
"What is the purpose of a boot sector?","The boot sector is a region of a storage device that contains the code necessary to start the boot process and load the operating system."
"What is the difference between a software and a hardware interrupt?","A software interrupt is generated by a software instruction to signal an event, while a hardware interrupt is generated by a hardware device to signal an event that requires immediate attention."
"What is a memory mapped I/O?","Memory mapped I/O is a method of performing input/output operations by mapping hardware device registers into the memory address space, allowing devices to be accessed as if they were memory locations."
"What is a page frame?","A page frame is a fixed-size block of physical memory that corresponds to a page in virtual memory, used in paging systems to manage memory allocation."
"What is the difference between a buffer and a cache?","A buffer is a temporary storage area used to hold data while it is being transferred between two locations, while a cache is a high-speed storage area used to hold frequently accessed data to improve performance."
"What is a memory fence?","A memory fence is a synchronization mechanism that ensures memory operations are completed in a specific order, preventing certain types of memory access issues."
"What is the purpose of a disk buffer?","A disk buffer is a temporary storage area used to hold data being read from or written to a disk, improving the efficiency of disk operations by reducing the number of direct accesses to the disk."
"What is a scheduler queue?","A scheduler queue is a data structure used by the operating system to manage the processes that are waiting to be executed, typically organized by priority or arrival time."
"What is the difference between a soft and hard interrupt?","A soft interrupt, or software interrupt, is generated by software to signal an event, while a hard interrupt, or hardware interrupt, is generated by hardware devices to signal an event that requires immediate attention."
"What is a semaphore used for in operating systems?","A semaphore is used to manage access to shared resources in concurrent programming, preventing race conditions and ensuring synchronization between processes or threads."
"What is the purpose of the inode in a file system?","An inode is a data structure used in many file systems to store information about a file, including its size, permissions, timestamps, and data block locations."
"What is the role of the file descriptor?","A file descriptor is an integer that uniquely identifies an open file in a process, used by the operating system to manage and access files."
"What is a shell script?","A shell script is a text file containing a series of commands for a shell to execute, allowing for the automation of tasks and the execution of complex sequences of operations."
"What is the difference between a relative and absolute path?","A relative path specifies a location relative to the current directory, while an absolute path specifies a location from the root of the file system."
"What is a memory mapped device?","A memory mapped device is a hardware device that is accessed by mapping its registers into the memory address space, allowing it to be controlled using memory read and write operations."
"What is the purpose of a file handle?","A file handle is an abstract representation of an open file, used by the operating system to manage file operations and maintain the state of the file."
"What is the difference between blocking and non-blocking I/O?","Blocking I/O operations wait for the operation to complete before returning control to the program, while non-blocking I/O operations allow the program to continue executing while the operation is performed in the background."
"What is the role of the system clock?","The system clock provides the timing mechanism for the operating system, managing the scheduling of processes, coordinating system events, and maintaining accurate timekeeping."
"What is a system interrupt?","A system interrupt is a signal emitted by hardware or software to the processor, indicating an event that needs immediate attention and temporarily halting the current execution to address the event."
"What is a page directory entry (PDE)?","A PDE is an entry in the page directory used in virtual memory systems to store the address of a page table, facilitating the translation of virtual addresses to physical addresses."
