input,output
"What is the difference between user space and kernel space?","User space is the memory area where user applications run, while kernel space is the memory area where the operating system kernel and its services run, providing controlled access to hardware and system resources."
"What is the purpose of a device controller?","A device controller is a hardware component that manages the communication between the operating system and a specific hardware device, handling tasks like data transfer, error checking, and device control."
"What is a system bus?","A system bus is a communication pathway used to connect various components of a computer system, including the CPU, memory, and peripheral devices, allowing them to communicate and transfer data."
"What happens when applications use too much memory?","High memory usage can cause applications to slow down, freeze, or terminate unexpectedly."
"How does high memory usage affect programs?","High memory usage can cause applications to slow down, freeze, or terminate unexpectedly."
"What are the impacts of high memory usage on apps?","High memory usage can cause applications to slow down, freeze, or terminate unexpectedly."
"What occurs when memory usage is too high?","High memory usage can cause applications to slow down, freeze, or terminate unexpectedly."
"Explain disk I/O.","Disk I/O refers to the input/output operations on a storage device."
"What does disk I/O mean?","Disk I/O refers to the input/output operations on a storage device."
"What is meant by disk I/O?","Disk I/O refers to the input/output operations on a storage device."
"Describe the concept of disk I/O.","Disk I/O refers to the input/output operations on a storage device."
"What happens with high disk I/O?","High disk I/O can slow down system performance by creating bottlenecks."
"How does high disk I/O affect a system?","High disk I/O can slow down system performance by creating bottlenecks."
"What are the impacts of high disk I/O?","High disk I/O can slow down system performance by creating bottlenecks."
"What issues arise from high disk I/O?","High disk I/O can slow down system performance by creating bottlenecks."
"What is a computing process?","A process is an instance of a program that is being executed."
"Define a process in computing.","A process is an instance of a program that is being executed."
"What does a process refer to in computing?","A process is an instance of a program that is being executed."
"Explain a process in a computer system.","A process is an instance of a program that is being executed."
"What is a computing thread?","A thread is the smallest unit of a process that can be scheduled for execution."
"Define a thread in computing.","A thread is the smallest unit of a process that can be scheduled for execution."
"What does a thread refer to in computing?","A thread is the smallest unit of a process that can be scheduled for execution."
"Explain a thread in a computer system.","A thread is the smallest unit of a process that can be scheduled for execution."
"What distinguishes a process from a thread?","A process is an independent program while a thread is a segment of a process."
"How do processes and threads differ?","A process is an independent program while a thread is a segment of a process."
"What is the difference between threads and processes?","A process is an independent program while a thread is a segment of a process."
"Compare a process to a thread.","A process is an independent program while a thread is a segment of a process."
"What impact does network latency have?","High network latency can cause delays in data transmission and slow down application performance."
"How does network latency affect performance?","High network latency can cause delays in data transmission and slow down application performance."
"What are the effects of high network latency?","High network latency can cause delays in data transmission and slow down application performance."
"What happens with high network latency?","High network latency can cause delays in data transmission and slow down application performance."
"What is virtual memory in computing?","Virtual memory is a memory management technique that provides an application with more memory than physically available."
"Define virtual memory.","Virtual memory is a memory management technique that provides an application with more memory than physically available."
"Explain virtual memory.","Virtual memory is a memory management technique that provides an application with more memory than physically available."
"What does virtual memory mean?","Virtual memory is a memory management technique that provides an application with more memory than physically available."
"Why is cache memory significant?","Cache memory improves performance by storing frequently accessed data for quick retrieval."
"What is the importance of cache memory?","Cache memory improves performance by storing frequently accessed data for quick retrieval."
"What role does cache memory play?","Cache memory improves performance by storing frequently accessed data for quick retrieval."
"Explain the significance of cache memory.","Cache memory improves performance by storing frequently accessed data for quick retrieval."
"What is a context switch in computing?","A context switch is the process of storing and restoring the state of a CPU so that multiple processes can share a single CPU."
"Define context switch.","A context switch is the process of storing and restoring the state of a CPU so that multiple processes can share a single CPU."
"What does context switch mean?","A context switch is the process of storing and restoring the state of a CPU so that multiple processes can share a single CPU."
"Explain the process of a context switch.","A context switch is the process of storing and restoring the state of a CPU so that multiple processes can share a single CPU."
"What is the effect of frequent context switches?","Frequent context switches can degrade performance due to overhead."
"How do context switches impact performance?","Frequent context switches can degrade performance due to overhead."
"What are the impacts of context switches?","Frequent context switches can degrade performance due to overhead."
"What happens with many context switches?","Frequent context switches can degrade performance due to overhead."
"What is a memory leak in software?","A memory leak occurs when a program does not release memory that is no longer needed."
"Define memory leak.","A memory leak occurs when a program does not release memory that is no longer needed."
"What does memory leak mean?","A memory leak occurs when a program does not release memory that is no longer needed."
"Explain a memory leak.","A memory leak occurs when a program does not release memory that is no longer needed."
"How to prevent memory leaks?","Memory leaks can be prevented by properly managing memory allocation and deallocation."
"What methods prevent memory leaks?","Memory leaks can be prevented by properly managing memory allocation and deallocation."
"How can we avoid memory leaks?","Memory leaks can be prevented by properly managing memory allocation and deallocation."
"What are the strategies to prevent memory leaks?","Memory leaks can be prevented by properly managing memory allocation and deallocation."
"What is a CPU core?","A CPU core is a single processing unit within a CPU that can execute instructions independently."
"How does multi-threading improve performance?","Multi-threading improves performance by allowing multiple threads to run concurrently, making better use of CPU resources."
"What is system load?","System load is a measure of the amount of computational work that a computer system is performing."
"Why is RAM important for system performance?","RAM is important because it stores data that is actively being used, allowing for quick access and efficient processing."
"What is a deadlock in computing?","A deadlock is a situation where two or more processes are unable to proceed because each is waiting for the other to release a resource."
"How does a deadlock occur?","A deadlock occurs when two or more processes are unable to proceed because each is waiting for the other to release a resource."
"What is the function of a GPU?","A GPU accelerates rendering of images and video and is essential for tasks such as gaming, video editing, and machine learning."
"How does a hard drive differ from an SSD?","A hard drive uses spinning disks to read/write data, while an SSD uses flash memory, making it faster and more reliable."
"What is the role of an operating system?","An operating system manages hardware and software resources, providing services for computer programs."
"How does a firewall enhance security?","A firewall monitors and controls incoming and outgoing network traffic based on predetermined security rules."
"What is the purpose of a database index?","A database index improves the speed of data retrieval operations on a database table."
"Why is data encryption important?","Data encryption protects sensitive information by converting it into a code, making it unreadable without a decryption key."
"What is a network protocol?","A network protocol is a set of rules that govern data communication between devices on a network."
"How does load balancing improve performance?","Load balancing distributes network or application traffic across multiple servers to ensure no single server becomes overwhelmed."
"What is cloud computing?","Cloud computing delivers computing services over the internet, allowing for on-demand access to resources like storage and processing power."
"How does a VPN work?","A VPN creates a secure, encrypted connection between your device and the internet, protecting your data from interception."
"What is the purpose of a cache?","A cache stores frequently accessed data temporarily, allowing for faster data retrieval."
"How does data compression work?","Data compression reduces the size of files by encoding information more efficiently."
"What is a command-line interface (CLI)?","A CLI allows users to interact with a computer program by typing commands."
"Why is multi-factor authentication important?","Multi-factor authentication enhances security by requiring multiple forms of verification before granting access."
"What is a software patch?","A software patch is an update that fixes bugs, improves performance, or adds new features to a software program."
"How does a compiler work?","A compiler translates source code written in a high-level programming language into machine code that a computer's CPU can execute."
"What is a virtual machine (VM)?","A VM is a software-based emulation of a physical computer that runs an operating system and applications."
"How does blockchain technology work?","Blockchain is a distributed ledger that records transactions in a secure, immutable way, ensuring transparency and integrity."
"What is artificial intelligence (AI)?","AI is the simulation of human intelligence processes by machines, especially computer systems."
"Why is cybersecurity important?","Cybersecurity protects systems, networks, and programs from digital attacks, ensuring data confidentiality, integrity, and availability."
"What is a denial-of-service (DoS) attack?","A DoS attack aims to make a machine or network resource unavailable to its intended users by temporarily disrupting services."
"How does machine learning differ from traditional programming?","Machine learning allows systems to learn from data and improve over time without being explicitly programmed."
"What is the Internet of Things (IoT)?","IoT refers to the network of interconnected devices that communicate and exchange data with each other over the internet."
"How does a router work?","A router forwards data packets between computer networks, directing traffic on the internet."
"What is the role of a server?","A server provides services, resources, and data to other computers over a network."
"How does a database management system (DBMS) work?","A DBMS provides tools to create, manage, and interact with databases, ensuring data integrity and security."
"What is the function of an API?","An API allows different software applications to communicate and interact with each other."
"Why is data backup important?","Data backup ensures that a copy of your data is available in case of hardware failure, data corruption, or other disasters."
"What is a content delivery network (CDN)?","A CDN distributes content to multiple servers worldwide to ensure fast delivery to users based on their geographic location."
"How does data mining work?","Data mining involves analyzing large datasets to discover patterns, trends, and insights."
"What is the function of a web browser?","A web browser allows users to access, retrieve, and view information on the internet."
"How does a kernel work in an operating system?","The kernel manages system resources, communication between hardware and software, and overall system operations."
"What is a hypervisor?","A hypervisor is software that creates and manages virtual machines by allocating resources from a physical host."
"Why is software testing important?","Software testing ensures that applications function correctly, meet requirements, and are free of bugs and vulnerabilities."
"What is a software development lifecycle (SDLC)?","SDLC is a process for planning, creating, testing, and deploying software applications."
"How does a microprocessor work?","A microprocessor executes instructions from a computer program by performing basic arithmetic, logic, control, and input/output operations."
"What is quantum computing?","Quantum computing leverages the principles of quantum mechanics to perform computations that are infeasible for classical computers."
"How does artificial neural networks work?","Artificial neural networks are computing systems inspired by the brain's neural networks, used in machine learning to recognize patterns and make decisions."
"What is edge computing?","Edge computing processes data near the source of data generation, reducing latency and bandwidth usage."
"How does a blockchain consensus algorithm work?","A blockchain consensus algorithm ensures that all nodes in the network agree on the validity of transactions and the state of the blockchain."
"What is the role of a system administrator?","A system administrator manages and maintains computer systems and networks, ensuring their reliability and security."
"What is the function of an IDE?","An IDE (Integrated Development Environment) provides comprehensive facilities to programmers for software development, including a code editor, debugger, and build tools."
"How does a network switch work?","A network switch connects devices within a network and uses packet switching to forward data to its destination."
"What is the purpose of a bootloader?","A bootloader initializes the operating system when a computer is turned on."
"How does public key encryption work?","Public key encryption uses a pair of keys (public and private) to encrypt and decrypt data, ensuring secure communication."
"What is a software license?","A software license is a legal agreement that specifies how a software product can be used and distributed."
"How does a proxy server work?","A proxy server acts as an intermediary between a client and a server, forwarding requests and responses while providing various network services."
"What is containerization in software development?","Containerization involves packaging an application and its dependencies into a container, ensuring consistency across different environments."
"Why is network segmentation important?","Network segmentation divides a network into smaller segments to improve security, performance, and manageability."
"What is the purpose of a domain name system (DNS)?","DNS translates human-readable domain names into IP addresses that computers use to identify each other on the network."
"How does RAID improve storage reliability?","RAID (Redundant Array of Independent Disks) improves storage reliability by distributing data across multiple disks and providing redundancy."
"What is the function of a load balancer?","A load balancer distributes network traffic across multiple servers to ensure reliability and performance."
"How does a hashing algorithm work?","A hashing algorithm converts input data into a fixed-size string of characters, which is typically a hash code."
"What is the role of an IT helpdesk?","An IT helpdesk provides technical support and assistance to users, resolving IT-related issues and ensuring smooth operation."
"Why is software documentation important?","Software documentation provides detailed information on how to use, configure, and maintain software, aiding users and developers."
"What is the function of a DHCP server?","A DHCP server automatically assigns IP addresses and other network configuration parameters to devices on a network."
"How does a wireless access point work?","A wireless access point connects wireless devices to a wired network, providing Wi-Fi connectivity."
"What is the purpose of a session in web development?","A session stores user data between HTTP requests, allowing for persistent user interaction with a web application."
"How does a relational database work?","A relational database stores data in tables with rows and columns, allowing for efficient data retrieval and management using SQL."
"What is the function of a network firewall?","A network firewall monitors and controls incoming and outgoing network traffic based on predetermined security rules."
"How does a machine learning model learn?","A machine learning model learns by analyzing data and identifying patterns, which it uses to make predictions or decisions."
"What is the purpose of a version control system?","A version control system manages changes to source code, allowing multiple developers to collaborate and track revisions."
"How does a web server work?","A web server processes incoming network requests over HTTP and serves web pages to clients."
"What is a cybersecurity threat?","A cybersecurity threat is any potential malicious attack that seeks to access, damage, or disrupt computer systems, networks, or data."
"How does a phishing attack work?","A phishing attack involves tricking individuals into providing sensitive information by pretending to be a trustworthy entity."
"What is a botnet?","A botnet is a network of compromised computers controlled by an attacker to perform coordinated malicious activities."
"How does a password manager enhance security?","A password manager securely stores and manages passwords, generating strong passwords and reducing the risk of password-related breaches."
"What is a distributed denial-of-service (DDoS) attack?","A DDoS attack overwhelms a target system with a flood of internet traffic, causing disruption or unavailability."
"How does encryption protect data?","Encryption converts data into a code to prevent unauthorized access, ensuring data confidentiality and integrity."
"What is the purpose of a security audit?","A security audit assesses the security of an organization's information systems, identifying vulnerabilities and ensuring compliance with security policies."
"How does artificial intelligence impact cybersecurity?","Artificial intelligence enhances cybersecurity by analyzing vast amounts of data to detect and respond to threats in real-time."
"What is the function of a network gateway?","A network gateway connects different networks, enabling communication and data transfer between them."
"How does data loss prevention (DLP) work?","Data loss prevention (DLP) tools monitor, detect, and block the transfer of sensitive data outside an organization's network."
"What is the purpose of a security token?","A security token provides an additional layer of authentication, ensuring that only authorized users can access a system."
"How does intrusion detection system (IDS) work?","An intrusion detection system (IDS) monitors network traffic for suspicious activity and alerts administrators to potential threats."
"What is a sandbox in cybersecurity?","A sandbox isolates and runs untested or untrusted programs in a controlled environment to prevent potential harm to the system."
"How does a virtual private network (VPN) enhance privacy?","A VPN encrypts internet traffic and masks the user's IP address, ensuring privacy and security while browsing the web."
"What is the role of a cybersecurity analyst?","A cybersecurity analyst protects an organization's computer systems and networks by identifying, analyzing, and mitigating security threats."
"How does a security information and event management (SIEM) system work?","A SIEM system collects and analyzes security data from various sources to detect, investigate, and respond to security incidents."
"What is the function of a network switch?","A network switch connects devices within a network and uses packet switching to forward data to its destination."
"How does a packet sniffer work?","A packet sniffer captures and analyzes network traffic, allowing administrators to monitor and troubleshoot network issues."
"What is the purpose of a secure sockets layer (SSL)?","SSL encrypts data transmitted between a web server and a client, ensuring secure communication over the internet."
"How does a firewall enhance security?","A firewall monitors and controls incoming and outgoing network traffic based on predetermined security rules."
"What is the function of an email gateway?","An email gateway filters and scans incoming and outgoing email traffic for spam, viruses, and other malicious content."
"How does two-factor authentication (2FA) work?","Two-factor authentication (2FA) requires users to provide two forms of verification before granting access, enhancing security."
"What is the role of a database administrator (DBA)?","A database administrator (DBA) manages and maintains databases, ensuring data integrity, security, and performance."
"How does an intrusion prevention system (IPS) work?","An intrusion prevention system (IPS) detects and prevents malicious activities by analyzing network traffic and blocking threats."
"What is the purpose of a security policy?","A security policy defines the rules and procedures for protecting an organization's information assets and ensuring data security."
"How does a content management system (CMS) work?","A content management system (CMS) allows users to create, edit, and manage digital content without requiring technical expertise."
"What is the function of a digital certificate?","A digital certificate verifies the identity of a user or device, ensuring secure communication and data exchange."
"How does a security incident response team (SIRT) work?","A security incident response team (SIRT) investigates and responds to security incidents, mitigating potential damage and restoring normal operations."
"What is the purpose of a network time protocol (NTP)?","Network time protocol (NTP) synchronizes the clocks of computers over a network to ensure accurate timekeeping."
"How does a secure file transfer protocol (SFTP) work?","Secure file transfer protocol (SFTP) encrypts data during transfer, ensuring secure file exchange between remote systems."
"What is the function of a patch management system?","A patch management system automates the process of updating software with patches to fix vulnerabilities and improve performance."
"How does a virtual private cloud (VPC) work?","A virtual private cloud (VPC) provides a secure, isolated environment within a public cloud for running applications and storing data."
"What is the role of a security operations center (SOC)?","A security operations center (SOC) monitors and analyzes an organization's security posture, detecting and responding to threats in real-time."
"How does a network intrusion detection system (NIDS) work?","A network intrusion detection system (NIDS) monitors network traffic for suspicious activity, alerting administrators to potential threats."
"What is the purpose of a public key infrastructure (PKI)?","Public key infrastructure (PKI) provides a framework for managing digital certificates and public-key encryption, ensuring secure communication."
"How does a remote access Trojan (RAT) work?","A remote access Trojan (RAT) allows an attacker to gain control of a victim's computer, enabling remote access and surveillance."
"What is the function of a security information and event management (SIEM) system?","A SIEM system collects and analyzes security data from various sources to detect, investigate, and respond to security incidents."
"How does a network access control (NAC) system work?","A network access control (NAC) system enforces security policies by controlling access to network resources based on the identity and security posture of devices."
"What is the purpose of a security operations center (SOC)?","A security operations center (SOC) monitors and analyzes an organization's security posture, detecting and responding to threats in real-time."
"How does a security incident response plan work?","A security incident response plan outlines the procedures for identifying, responding to, and recovering from security incidents."
"What is the function of a security information and event management (SIEM) system?","A SIEM system collects and analyzes security data from various sources to detect, investigate, and respond to security incidents."
"How does a network intrusion detection system (NIDS) work?","A network intrusion detection system (NIDS) monitors network traffic for suspicious activity, alerting administrators to potential threats."
"What is the purpose of a public key infrastructure (PKI)?","Public key infrastructure (PKI) provides a framework for managing digital certificates and public-key encryption, ensuring secure communication."
